lemma	domains	subdomains	definitions
ποιεω	'[''Case'', ''Perform, Do'', ''Be, Become, Exist, Happen'', ''Perform, Do'', ''Perform, Do'', ''Behavior and Related States'', ''Control, Rule'', ''Possess, Transfer, Exchange'', ''Physiological Processes and States'', ''Be, Become, Exist, Happen'', ''Attitudes and Emotions'']'	'[''Agent of a Numerable Event'', ''Do, Perform'', ''State'', ''Work, Toil'', ''Make, Create'', ''Behavior, Conduct'', ''Assign to a Role or Function'', ''Earn, Gain, Do Business'', ''Ripen, Produce Fruit, Bear Seed'', ''Exist'', ''Acceptable To, To Be Pleased With'']'	'[''a marker of an agent relation with a numerable event'', ''to do or perform (highly generic for almost any type of activity)'', ''to cause a state to be{N:002}'', ''to engage in an activity involving considerable expenditure of effort'', ''to produce something new, with the implication of using materials already in existence (in contrast with {L:κτίζω<SDBG:κτίζω:000000>} ‘to create,’ {D:42.35})'', ''to behave or act in a particular way with respect to someone'', ''to cause someone to assume a particular type of function'', ''to gain by means of one’s activity or investment'', ''(an idiom, literally to make fruit) to produce fruit or seed (of plants){N:003}'', ''(an idiom, literally to make fruit) to cause results to exist'', ''(an idiom, literally: to do what is enough) to cause someone to be pleased by doing what will satisfy'']'
ποιημα	'[''Perform, Do'']'	'[''Make, Create'']'	'[''(derivative of {L:ποιέω<SDBG:ποιέω:000004>}[e] ‘to make,’ {D:42.29}) that which is made'']'
ποιησις	'[''Perform, Do'']'	'[''Do, Perform'']'	'[''doing or performing (highly generic for almost any type of activity)'']'
ποικίλλω	'[''Artifacts'']'	'[''Adornments'', ''Give'', ''Do, Perform'']'	to decorate with diverse colors or patterns
ποιμαινω	'[''Animal Husbandry, Fishing'', ''Guide, Discipline, Follow'', ''Control, Rule'']'	'[''Guide, Lead'', ''Rule, Govern'']'	'[''to herd and tend flocks of sheep or goats'', ''(a figurative extension of meaning of {L:ποιμαίνω<SDBG:ποιμαίνω:000000>}[a] ‘to shepherd,’ {D:44.3}) to lead, with the implication of providing for'', ''to rule, with the implication of direct personal involvement'']'
ποιμνιον	'[''Groups and Classes of Persons and Members of Such Groups and Classes'']'	'[''Socio-Religious'']'	'[''(a figurative extension of meaning of ποίμνιον ‘flock,’ not occurring in the NT) the followers of Christ constituting a well-defined membership group'']'
πόκος	'[''Body, Body Parts, and Body Products'']'	'[''Animals'']'	the soft, thick hair of sheep or similar animals
πολεμεω	'[''Military Activities'', ''Hostility, Strife'']'	'[''To Fight'', ''Strife, Struggle'']'	'[''to engage in open warfare'', ''(figurative extension of meaning of {L:πολεμέω<SDBG:πολεμέω:000000>}[a] ‘to wage war,’ {D:55.5}) to engage in serious and protracted conflict, often involving a series of attacks'']'
πολεμος	'[''Military Activities'', ''Hostility, Strife'']'	'[''To Fight'', ''Strife, Struggle'']'	'[''act of engaging in open warfare'', ''(figurative extension of meaning of {L:πόλεμος<SDBG:πόλεμος:000000>}[a] ‘war,’ {D:55.5}) act of engaging in serious and protracted conflict, often involving a series of attacks'']'
πολις	'[''Geographical Objects and Features'', ''Geographical Objects and Features'', ''Groups and Classes of Persons and Members of Such Groups and Classes'']'	'[''Population Centers'', ''Population Centers'', ''Socio-Political'']'	'[''a population center, in contrast with a rural area or countryside and without specific reference to size{N:001}'', ''a population center of relatively greater importance (in contrast with {L:κώμη<SDBG:κώμη:000000>}[a] ‘village,’ {D:1.92}, and {L:κωμόπολις<SDBG:κωμόπολις:000001>}[b], in contrast with other terms for population centers)'', ''the inhabitants of a city{N:002}'']'
πολυέλεος	'[''Religious Activities'']'	'[''Mercy, Merciless'', ''Love, Affection, Compassion'']'	full of mercy, often describing God’s abundant compassion
πολυς	'[''Quantity'', ''Quantity'', ''Degree'', ''Quantity'', ''Degree'', ''Proper, Improper'', ''Time'', ''Time'']'	'[''Many, Few [Countables]'', ''Much, Little [Masses, Collectives, Extensions]'', ''Much, Little [Positive-Negative Degree]'', ''Many, Few [Countables]'', ''More Than, Less Than [Comparative Degree]'', ''A Point of Time without Reference to Other Points of Time: Time, Occasion, Ever, Often'', ''Duration of Time without Reference to Points or Units of Time: Time, Spend Time, Always, Eternal, Old, Immediately, Young'']'	'[''a relatively large quantity of objects or events'', ''a relatively large quantity'', ''the upper range of a scale of extent, but probably somewhat less than for {L:μέγας<SDBG:μέγας:000001>}[b], {L:μεγάλως<SDBG:μεγάλως:000000>}, and {L:μέγεθος<SDBG:μέγεθος:000000>} ({D:78.2})'', ''the largest number of objects or events possible under the circumstances'', ''a degree which surpasses in some manner a point on an explicit or implicit scale of extent{N:001}'', ''pertaining to being more appropriate or fitting'', ''a number of related points of time'', ''pertaining to a relatively long duration of time'']'
πολυτόκος	'[''Physiological Processes and States''}'	'[''Birth, Procreation'', ''Children'']'	producing many children or offspring
πολυωρέω	'[''Time'']'	'[''Duration of Time without Reference to Points or Units of Time: Time, Spend Time, Always, Eternal, Old, Immediately, Young'', ''Remain, Stay'']'	to wait or remain for a long time
πομα	'[''Foods and Condiments'']'	'[''Food'']'	'[''liquids used for nourishment or to satisfy thirst'']'
πονηρεύομαι	'[''Moral and Ethical Qualities and Related Behavior'']'	'[''Act Lawlessly'']'	to behave in an evil or corrupt way
πονηρια	'[''Moral and Ethical Qualities and Related Behavior'', ''Moral and Ethical Qualities and Related Behavior'']'	'[''Bad, Evil, Harmful, Damaging'', ''Bad, Evil, Harmful, Damaging'']'	'[''an evil, wicked nature'', ''deeds which are wicked and evil'']'
πονηρος	'[''Moral and Ethical Qualities and Related Behavior'', ''Value'', ''Moral and Ethical Qualities and Related Behavior'', ''Physiological Processes and States'', ''Supernatural Beings and Powers'', ''Moral and Ethical Qualities and Related Behavior'', ''Possess, Transfer, Exchange'']'	'[''Bad, Evil, Harmful, Damaging'', ''Good, Bad'', ''Sin, Wrongdoing, Guilt'', ''Sickness, Disease, Weakness'', ''Supernatural Beings'', ''Envy, Jealousy'', ''Give'']'	'[''pertaining to being morally corrupt and evil'', ''pertaining to possessing a serious fault and consequently being worthless'', ''pertaining to guilt resulting from an evil deed'', ''(a figurative extension of meaning of {L:πονηρός<SDBG:πονηρός:000000>}[a] ‘evil,’ {D:88.110}) a state of being sickly or diseased (in the NT with special reference to the eyes)'', ''(a title for the Devil, literally: the evil one) the one who is essentially evil or in a sense personifies evil'', ''(an idiom, literally: evil eye) a feeling of jealousy and resentment because of what someone else has or does'', ''(an idiom, literally: evil eye) to be stingy'']'
πονος	'[''Sensory Events and States'', ''Perform, Do'']'	'[''Pain, Suffering'', ''Work, Toil'']'	'[''the experience of pain, normally involving both continuity and intensity'', ''hard work, implying accompanying pain and distress'']'
πορεια	'[''Linear Movement'', ''Possess, Transfer, Exchange'']'	'[''Travel, Journey'', ''Earn, Gain, Do Business'']'	'[''to move a considerable distance, either with a single destination or from one destination to another in a series'', ''business pursuits, with the implication of extensive activity and journeys required'']'
πορευομαι	'[''Linear Movement'', ''Linear Movement'', ''Linear Movement'', ''Behavior and Related States'', ''Physiological Processes and States'']'	'[''Move, Come/Go'', ''Travel, Journey'', ''Leave, Depart, Flee, Escape, Send'', ''Behavior, Conduct'', ''Live, Die'']'	'[''to move from one place to another, with the possible implication of continuity and distance{N:001}'', ''to move a considerable distance, either with a single destination or from one destination to another in a series'', ''to move away from a reference point'', ''to live or behave in a customary manner, with possible focus upon continuity of action'', ''to depart from life, as a euphemistic expression for death{N:003}'']'
πορνευω	'[''Moral and Ethical Qualities and Related Behavior'']'	'[''Sexual Misbehavior'']'	'[''to engage in sexual immorality of any kind, often with the implication of prostitution'']'
ποσακις	'[''Time'']'	'[''A Point of Time without Reference to Other Points of Time: Time, Occasion, Ever, Often'']'	'[''a number of related points of time, occurring in interrogative or exclamatory contexts'']'
ποσάπλως	'[''Quantity'']'	'[''Number, Countless'']'	indicating multiple repetition or frequency
ποσος	'[''Quantity'', ''Quantity'', ''Degree'']'	'[''Many, Few [Countables]'', ''Much, Little [Masses, Collectives, Extensions]'', ''Much, Little [Positive-Negative Degree]'']'	'[''interrogative of quantity of objects or events, usually implying a considerable amount'', ''interrogative of quantity'', ''a relatively high point on a scale involving exclamation'']'
ποταμος	'[''Geographical Objects and Features'']'	'[''Bodies of Water'']'	'[''a river or stream normally flowing throughout the year (in contrast with {L:χείμαρρος<SDBG:χείμαρρος:000001>}[b] ‘winter stream,’ {D:1.77})'']'
ποτε	'[''Time'', ''Time'']'	'[''A Point of Time without Reference to Other Points of Time: Time, Occasion, Ever, Often'', ''A Point of Time with Reference to Other Points of Time: Before, Long Ago, Now, At the Same Time, When, About, After'']'	'[''an indefinite point of time or occasion'', ''a point of time which is roughly simultaneous to or overlaps with another point of time'']'
ποτε	'[''Time'', ''Time'']'	'[''A Point of Time without Reference to Other Points of Time: Time, Occasion, Ever, Often'', ''A Point of Time with Reference to Other Points of Time: Before, Long Ago, Now, At the Same Time, When, About, After'']'	'[''an indefinite point of time or occasion'', ''a point of time which is roughly simultaneous to or overlaps with another point of time'']'
ποτηριον	'[''Artifacts'', ''Case'', ''Sensory Events and States'']'	'[''Containers'', ''To Cause To Experience'', ''Pain, Suffering'']'	'[''an object from which one may drink'', ''(an idiom, literally: to take the cup … from) to cause someone to not undergo some trying experience'', ''(an idiom, literally: to drink a cup) to undergo a trying, difficult experience'']'
ποτιζω	'[''Physiological Processes and States'', ''Agriculture'']'	'[''Eat, Drink'']'	'[''to cause to drink'', ''to provide water for plants'']'
που	'[''Spacial Positions'', ''Degree'']'	'[''Where, Somewhere, Everywhere'', ''About, Approximately, Almost, Hardly [Approximate Degree]'']'	'[''an indefinite position in space'', ''a degree which falls just short of some point on a scale of extent'']'
πους	'[''Body, Body Parts, and Body Products'', ''Association'', ''Moral and Ethical Qualities and Related Behavior'', ''Possess, Transfer, Exchange'', ''Behavior and Related States'', ''Control, Rule'']'	'[''Parts of the Body'', ''Show Hospitality'', ''Humility'', ''Give'', ''Particular Patterns of Behavior'', ''Control, Restrain'']'	'[''the part of the leg below the ankle on which a person or animal stands and moves'', ''(an idiom, literally: to wash the feet, derived from the practice of washing the feet of any guest entering the home) to show sincere and gracious hospitality to someone'', ''(an idiom, literally: to wash the feet) to show humility by doing humble tasks'', ''(idioms, literally: to put at someone’s feet) to present something to someone who is reckoned as having superior status or position'', ''(an idiom, literally: to make straight wheel tracks for the feet) to live or behave in strict conformance to a predetermined model for behavior'', ''(idioms, literally under the feet of, and:  footstool of the feet) to be under the complete control of someone'']'
πραγμα	'[''Be, Become, Exist, Happen'', ''Perform, Do'', ''Courts and Legal Procedures'']'	'[''Happen'', ''Do, Perform'', ''Lawsuit, Case'']'	'[''that which happens'', ''an activity involving a measure of complexity and responsibility'', ''legal action taken in a court of law against someone{N:001}'']'
πραΰνω	'[''Attitudes and Emotions'']'	'[''Gentleness, Mildness'']'	to soften or make gentle, to ease emotion or anger
πραυς	'[''Moral and Ethical Qualities and Related Behavior'']'	'[''Gentleness, Mildness'']'	'[''pertaining to being gentle and mild'']'
πραυτης	'[''Moral and Ethical Qualities and Related Behavior'']'	'[''Gentleness, Mildness'']'	'[''gentleness of attitude and behavior, in contrast with harshness in one’s dealings with others'']'
πρεπω	'[''Proper, Improper'']'	'[''Same or Equivalent Kind or Class'', ''Nature, Character'']'	'[''to be fitting or right, with the implication of possible moral judgment involved'']'
πρεσβείον	'[Groups and Classes of Persons and Members of Such Groups and Classes'']'	'[''Position, Rank'']'	an office or mission of a representative
πρέσβυς	'[''Be, Become, Exist, Happen'']'	'[''Duration of Time without Reference to Points or Units of Time: Time, Spend Time, Always, Eternal, Old, Immediately, Young'']'	a person advanced in age; an elder or senior
πρεσβυτερος	'[''Time'', ''Time'', ''People'', ''Religious Activities'']'	'[''Duration of Time without Reference to Points or Units of Time: Time, Spend Time, Always, Eternal, Old, Immediately, Young'', ''A Point of Time with Reference to Other Points of Time: Before, Long Ago, Now, At the Same Time, When, About, After'', ''Males'', ''Roles and Functions'']'	'[''pertaining to the older of two objects'', ''pertaining to a person who has lived in ancient times, that is to say, at a point long before the point of time of the discourse itself (πρεσβύτερος[b] may also carry the implication of prestige)'', ''an adult male or female advanced in years{N:001}'', ''a person of responsibility and authority in matters of socio-religious concerns, both in Jewish and Christian societies'']'
πρεσβυτης	'[''Names of Persons and Places'']'	'[''Males'']'	'[''an adult male advanced in years{N:001}'']'
προ	'[''Spacial Positions'', ''Time'', ''Value'', ''Time'', ''Time'', ''Time'']'	'[''In Front Of, Face To Face, In Back Of, Behind'', ''A Point of Time with Reference to Other Points of Time: Before, Long Ago, Now, At the Same Time, When, About, After'', ''Important, Unimportant'', ''A Point of Time with Reference to Other Points of Time: Before, Long Ago, Now, At the Same Time, When, About, After'', ''Duration of Time with Reference to Some Point of Time: Until, Delay, Still, From'', ''A Point of Time with Reference to Other Points of Time: Before, Long Ago, Now, At the Same Time, When, About, After'']'	'[''a position in front of an object, whether animate or inanimate, which is regarded as having a spacial orientation of front and back{N:001}'', ''a point of time prior to another point of time'', ''marker of primary importance'', ''(an idiom, literally: before the doors) a point of time subsequent to another point of time and indicating imminence, that is to say, the subsequent event is regarded as almost begun'', ''an exceedingly long period of time from an assumed beginning up to the present'', ''(an idiom, literally: before the face, equivalent in meaning to {L:πρό<SDBG:πρό:000001>}[b] ‘before,’ {D:67.17}, but a somewhat more elaborate phrase rhetorically) a point of time, possibly only a short time before another point of time'']'
προανατάσσω	'[''Military Activities'']'	'[''Roles and Functions'', ''Army'']'	to assign a role in advance, often in battle order
προβατον	'[''Animals'', ''Groups and Classes of Persons and Members of Such Groups and Classes'']'	'[''Animals'', ''Socio-Religious'']'	'[''herbivorous domestic mammal with four legs; Ovis ladicaudata - fat-tailed sheep; used for sacrifice, source of meat, milk, hides, wool, and horns'', ''(a figurative extension of meaning of {L:πρόβατον<SDBG:πρόβατον:000000>}[a] ‘sheep,’ {D:4.22}) a follower of Christ, with the implication of needing care and guidance'']'
προβλεπω	'[''Help, Care For'', ''Think'']'	'[''Provide For, Support'', ''To Choose, To Select, To Prefer'']'	'[''to provide for the needs of others, with the implication of anticipating such a need'', ''to choose or select in advance of some other event'']'
πρόβλημα	'[''Danger, Risk, Safe, Save'', ''Danger, Risk, Safe, Save'', ''Danger, Risk, Safe, Save'']'	'[''Danger'']'	something that causes difficulty or needs a solution
προκαταλαμβάνω	'[''Control, Rule'']'	'[''Have, Possess, Property, Owner'']'	to take possession or control before others
προοραω	'[''Sensory Events and States'', ''Know'']'	'[''See'', ''Know'']'	'[''to have seen something or someone beforehand or prior to an event in question'', ''to know about something prior to some temporal reference point, for example, to know about an event before it happens'']'
προπίπτω	'[''Linear Movement'', ''Linear Movement'']'	'[''Fall'']'	to fall forward, especially in reverence or urgency
προπορευομαι	'[''Linear Movement'', ''Linear Movement'']'	'[''Come/Go In Front Of'', ''Lead, Bring, Take'']'	'[''to move in front of or ahead of, with the implication that both parties are moving in the same direction'', ''to go in front of, in order to show the way'']'
προς	'[''Spacial Extensions'', ''Spacial Extensions'', ''Spacial Positions'', ''Spacial Positions'', ''Case'', ''Case'', ''Relations'', ''Relations'', ''Relations'', ''Relations'', ''Time'', ''Time'', ''Degree'', ''Relations'', ''Case'', ''Case'', ''Comparison'', ''Time'', ''Hostility, Strife'', ''Time'', ''Know'', ''Communication'']'	'[''Extension To a Goal'', ''Extension To a Goal'', ''At, Beside, Near, Far'', ''Among, Between, In, Inside'', ''Experiencer'', ''Content'', ''Association'', ''Purpose'', ''Result'', ''Relations Involving Correspondences [Isomorphisms]'', ''Indefinite Units of Time: Age, Lifetime, Interval, Period'', ''A Point of Time without Reference to Other Points of Time: Time, Occasion, Ever, Often'', ''Up To, As Much As, To the Degree That [Marked Extent of Degree]'', ''Specification'', ''Viewpoint Participant'', ''Opposition'', ''Duration of Time without Reference to Points or Units of Time: Time, Spend Time, Always, Eternal, Old, Immediately, Young'', ''Resistance'', ''Duration of Time without Reference to Points or Units of Time: Time, Spend Time, Always, Eternal, Old, Immediately, Young'', ''Not Able To Be Known, Secret'', ''Speak, Talk'']'	'[''extension toward a goal, with the probability of some type of implied interaction or reciprocity'', ''extension toward a goal, involving presumed contact and reaction'', ''a position near another location or object, often with the implication of facing toward'', ''a position within an area determined by other objects and distributed among such objects{N:002}'', ''a marker of an experiencer of an event, with the implication that the participant may then be in some dyadic relation'', ''(with the accusative) a marker of content, particularly when persons are involved and/or the context suggests some type of response being made'', ''a marker of association, often with the implication of interrelationships'', ''a marker of purpose, pointing to the goal of an event or state'', ''a marker of result, with focus upon the end point'', ''a marker of a relation involving correspondence, with the probable implication of some element of reciprocity'', ''a marker of a period of time occurring before a subsequent period, and implying anticipation'', ''a marker of a point of time, probably implying proximity'', ''a degree extending to a particular point as marked by the context'', ''a marker of a relation involving potential interaction'', ''(with the accusative) marking a participant whose viewpoint is relevant to an event{N:003}'', ''(with the accusative) a marker of opposition, with the probable implication of a reaction or response to a previous event'', ''a marker of that which is compared to something else'', ''pertaining to a relatively short period of time, with emphasis upon the temporary nature of the event or state'', ''(an idiom, literally: to kick against the goad) to react against authority in such a way as to cause harm or suffering to oneself'', ''pertaining to a relatively brief extent of time{N:004}'', ''(idiom, literally: to the ear) pertaining to what is known only by those who hear a particular message in private'', ''(an idiom, literally: to speak to the ear) to speak quietly and presumably to a restricted audience'']'
προσαββατον	'[''Time'']'	'[''Units of Time with Reference to Other Units or Points of Time: Yesterday, Today, Next Day'']'	'[''the day immediately before the Sabbath'']'
προσαγω	'[''Linear Movement'', ''Linear Movement'']'	'[''Lead, Bring, Take'', ''Come Near, Approach'']'	'[''to bring or lead into the presence of someone'', ''to move toward a reference point, with a possible implication in certain contexts of a reciprocal relationship between the person approaching and the one who is approached'']'
προσδεχομαι	'[''Hold a View, Believe, Trust'', ''Association'', ''Existence in Space'']'	'[''Accept As True'', ''Welcome, Receive'', ''Remain, Stay'']'	'[''to accept a message for oneself and to act accordingly'', ''to accept the presence of a person with friendliness{N:001}'', ''to remain in a place and/or state, with expectancy concerning a future event{N:002}'']'
προσδοκαω	'[''Attitudes and Emotions'', ''Think'']'	'[''Worry, Anxiety, Distress, Peace'', ''To Think Concerning Future Contingencies'']'	'[''to await with apprehension concerning impending danger or trouble'', ''to expect something to happen, whether good or bad'']'
προσδοκια	'[''Think'']'	'[''To Think Concerning Future Contingencies'']'	'[''to expect something to happen, whether good or bad'']'
προσεγγιζω	'[''Linear Movement'']'	'[''Come Near, Approach'']'	'[''to move toward a reference point, with a possible implication in certain contexts of a reciprocal relationship between the person approaching and the one who is approached'']'
προσερχομαι	'[''Linear Movement'', ''Association'', ''Hold a View, Believe, Trust'']'	'[''Come Near, Approach'', ''Join, Begin To Associate'', ''Agree, Consent'']'	'[''to move toward a reference point, with a possible implication in certain contexts of a reciprocal relationship between the person approaching and the one who is approached'', ''to take the initiative in association with someone'', ''(a figurative extension of meaning of {L:προσέρχομαι<SDBG:προσέρχομαι:000000>}[a] ‘to move toward,’ {D:15.77}) to come to a position of holding the same opinion as someone else'']'
προσευχη	'[''Communication'', ''Communication'']'	'[''Pray'', ''Pray'']'	'[''the act of speaking to or making requests of God{N:001}'', ''(derivative of {L:προσεύχομαι<SDBG:προσεύχομαι:000000>} ‘to pray,’ {D:33.178}) a place where people customarily meet to pray'']'
προσευχομαι	'[''Communication'']'	'[''Pray'']'	'[''to speak to or to make requests of God{N:001}'']'
προσεχω	'[''Learn'', ''Think'', ''Hold a View, Believe, Trust'', ''Aspect'']'	'[''Be Ready To Learn, Pay Attention'', ''To Think, Thought'', ''Believe To Be True'', ''Continue'']'	'[''to be in a continuous state of readiness to learn of any future danger, need, or error, and to respond appropriately'', ''to pay close attention to something, with the possible implication of agreement'', ''to hold firmly to a particular belief'', ''to continue with close attention and devotion'']'
προσηλυτος	'[''Groups and Classes of Persons and Members of Such Groups and Classes'']'	'[''Socio-Religious'']'	'[''a Gentile who had converted to Judaism'']'
προσκαλεω	'[''Communication'', ''Communication'']'	'[''Call'', ''Call'']'	'[''to call to, with a possible implication of a reciprocal relation'', ''to urgently invite someone to accept responsibilities for a particular task, implying a new relationship to the one who does the calling{N:001}'']'
προσκολλαω	'[''Association'']'	'[''Join, Begin To Associate'']'	'[''to begin an association with someone, whether temporary or permanent{N:001}'']'
προσκοπτω	'[''Physical Impact'', ''Linear Movement'', ''Attitudes and Emotions'']'	'[''Hit, Strike'', ''Walk, Step'', ''Offend, Be Offended'']'	'[''to strike against something, with the implication of resistance or damage'', ''to strike one’s foot against something as one walks and in this way to lose one’s balance temporarily'', ''to take offense, with the implication of a feeling of repugnance or rejection'']'
προσκυνεω	'[''Religious Activities'', ''Stances and Events Related to Stances'']'	'[''Worship, Reverence'', ''Prostrate as an Act of Reverence or Supplication'']'	'[''to express by attitude and possibly by position one’s allegiance to and regard for deity{N:001}'', ''to prostrate oneself before someone as an act of reverence, fear, or supplication{N:002}'']'
