lemma	domains	subdomains	definitions
δρακων	'[''Animals'']'	'["Reptiles and Other ''Creeping Things''"]'	'[''a legendary animal, usually regarded as being a kind of monstrous winged serpent or lizard'']'
δρασσομαι	'[''Learn'']'	'[''Learn Something Against Someone'']'	'[''(figurative extension of meaning of δράσσομαι ‘to catch, to seize,’ not occurring in the NT) to learn something about someone, with the purpose of seizing, arresting, or overcoming'']'
δρόσος	'[''Physical Events and States'']'	'[''Water'', ''Weather'']'	moisture in the form of dew formed during the night
δρυμός	'[''Geographical Objects and Features'']'	'[''Areas Which Are Uninhabited or Only Sparsely Populated'']'	a thickly wooded area or forest
δυναμαι	'[''Able, Capable'']'	'[''Able To Be Known'']'	'[''(derivative of {L:δύναμις<SDBG:δύναμις:000000>}[a] ‘ability,’ {D:74.1}) to be able to do or to experience something'']'
δυναμις	'[''Able, Capable'', ''Power, Force'', ''Power, Force'', ''Control, Rule'', ''Supernatural Beings and Powers'', ''Communication'']'	'[''Rule, Govern'', ''Supernatural Powers'', ''Interpret, Mean, Explain'']'	'[''the ability to perform a particular activity or to undergo some experience'', ''the potentiality to exert force in performing some function'', ''a deed manifesting great power, with the implication of some supernatural force'', ''one who has the power to rule'', ''(title for supernatural forces and powers) a supernatural power having some particular role in controlling the destiny and activities of human beings'', ''the meaning or significance of a word or statement'']'
δυναμοω	'[''Able, Capable'']'	'[''To Cause To Experience'', ''Able To Be Known'']'	'[''(derivative of {L:δύναμαι<SDBG:δύναμαι:000000>} ‘to be able,’ {D:74.5}) to cause someone to have the ability to do or to experience something'']'
δυναστεία	'[''Control, Rule'']'	'[''Exercise Authority'']'	a reign or period of authoritative rule
δυναστης	'[''Control, Rule'']'	'[''Rule, Govern'']'	'[''(derivative of {L:δύναμις<SDBG:δύναμις:000003>}[d] ‘ruler,’ {D:37.61}) one who is in a position of authority to command others'']'
δυνατος	'[''Mode'', ''Able, Capable'', ''Able, Capable'', ''Able, Capable'', ''Status'']'	'[''Possible, Impossible'', ''High Status or Rank [including persons of high status]'']'	'[''pertaining to being possible, with the implication of power or ability to alter or control circumstances'', ''(derivative of {L:δύναμις<SDBG:δύναμις:000000>}[a] ‘ability,’ {D:74.1}) pertaining to having the ability to perform some function'', ''pertaining to having special competence in performing some function'', ''(a title for God, literally: the one who is able) one who is capable of doing anything'', ''important persons, based upon their power or influence'']'
δυο	'[''Number'']'	'[''One, Two, Three, Etc. [Cardinals]'']'	'[''cardinal number, where there are two instances of a countable entity'']'
δυσις	'[''Spacial Orientations'']'	'[''North, South, East, West'']'	'[''None'']'
δυσμη	'[''Spacial Orientations'']'	'[''North, South, East, West'']'	'[''None'']'
δωδεκα	'[''Number'']'	'[''One, Two, Three, Etc. [Cardinals]'']'	'[''cardinal number, where there are twelve instances of a countable entity'', ''shorthand for the twelve disciples: ‘the twelve’'']'
δωηκ	'[''Names of Persons and Places'']'	'[''Persons'']'	'Edomite who killed priests at Saul''s command'
δωμα	'[''Constructions'', ''Know'']'	'[''Parts and Areas of Buildings'', ''Able To Be Known'']'	'[''the area on the top of a flat-roof house'', ''(an idiom, literally: on the housetops) pertaining to being widely known in view of the events in question having taken place in public{N:001}'']'
δωρεα	'[''Possess, Transfer, Exchange'']'	'[''Give'']'	'[''(derivative of {L:δωρέομαι<SDBG:δωρέομαι:000000>} ‘to give, to grant,’ {D:57.83}) that which is given or granted'']'
δωρεαν	'[''Possess, Transfer, Exchange'', ''Relations'', ''Relations'']'	'[''Give'', ''Cause and/or Reason'', ''Purpose'']'	'[''(derivative of {L:δωρέομαι<SDBG:δωρέομαι:000000>} ‘to give,’ {D:57.83}) pertaining to being freely given'', ''pertaining to there being no cause or legitimate reason'', ''pertaining to being without purpose'']'
δωρον	'[''Possess, Transfer, Exchange'', ''Artifacts'']'	'[''Give'', ''Containers'']'	'[''(derivative of {L:δωρέομαι<SDBG:δωρέομαι:000000>} ‘to give, to grant,’ {D:57.83}) that which is given or granted'', ''a place for making gifts or offerings (see {L:γαζοφυλάκιον<SDBG:γαζοφυλάκιον:000001>}[b] - {D:6.141}).'']'
εʹ	'[''Number'']'	'[''Number, Countless'']'	the fifth (ordinal numeral)
εαν	'[''Relations'', ''Time'', ''Mode'']'	'[''Condition'', ''A Point of Time with Reference to Other Points of Time: Before, Long Ago, Now, At the Same Time, When, About, After'', ''Possible, Impossible'']'	'[''a marker of condition, with the implication of reduced probability'', ''a point of time which is somewhat conditional and simultaneous with another point of time'', ''a marker of the possibility of any number of occurrences of some event'']'
εαρ	'[''Time'']'	'[''Definite Units of Time: Year, Month, Week, Day, Hour'', ''Weather'']'	spring, the season of renewal
εαυτου	'[''Discourse Referentials'', ''Discourse Referentials'']'	'[''Whom or What Spoken or Written About'', ''Reciprocal Reference'']'	'[''in the singular, a reflexive reference to a person or thing spoken or written about,{N:001} and in the plural, a reflexive reference to any and all persons or things involved as subjects of the clause (including first, second and third persons)'', ''a reciprocal reference between entities'']'
εβδομηκοντα	'[''Number'']'	'[''One, Two, Three, Etc. [Cardinals]'']'	'[''cardinal number, where there are seventy instances of a countable entity'']'
εγγιζω	'[''Linear Movement'', ''Time'']'	'[''Come Near, Approach'', ''A Point of Time with Reference to Other Points of Time: Before, Long Ago, Now, At the Same Time, When, About, After'']'	'[''to move nearer to a reference point'', ''the occurrence of a point of time close to a subsequent point of time'']'
εγγιστα	'[''Names of Persons and Places'', ''Geographical Objects and Features'']'	'[''At, Beside, Near, Far'']'	very near, in close proximity
εγγραπτος	'[''Communication'']'	'[''Written Language'', ''Written Language'']'	written down, inscribed
εγγυς	'[''Spacial Positions'', ''Time'']'	'[''At, Beside, Near, Far'', ''A Point of Time with Reference to Other Points of Time: Before, Long Ago, Now, At the Same Time, When, About, After'']'	'[''a position relatively close to another position'', ''a point of time subsequent to another point of time, but relatively close'']'
εγειρω	'[''Stances and Events Related to Stances'', ''Stances and Events Related to Stances'', ''Physiological Processes and States'', ''Be, Become, Exist, Happen'', ''Physiological Processes and States'', ''Be, Become, Exist, Happen'', ''Physiological Processes and States'', ''Stances and Events Related to Stances'', ''Physiological Processes and States'', ''Military Activities'']'	'[''Stand'', ''Stand'', ''Sleep, Waking'', ''Exist'', ''Live, Die'', ''Change of State'', ''Health, Vigor, Strength'', ''Stand'', ''Sleep, Waking'', ''To Fight'']'	'[''to cause to stand up, with a possible implication of some previous incapacity'', ''to get up, normally from a lying or reclining position but possibly from a seated position (in some contexts with the implication of some degree of previous incapacity)'', ''to cause someone to awaken'', ''to cause to come into existence'', ''to cause someone to live again after having once died'', ''to change to a previous good state'', ''(a figurative extension of meaning of {L:ἐγείρω<SDBG:ἐγείρω:000000>}[a] ‘to cause to stand up,’ {D:17.10}) to restore a person to health and vigor (somewhat equivalent to the English idiom to get him on his feet again)'', ''to get up, normally from a lying or reclining position but possibly from a seated position (in some contexts with the implication of some degree of previous incapacity)'', ''to become awake after sleeping'', ''to go to war against'']'
εγερσις	'[''Physiological Processes and States'']'	'[''Live, Die'']'	'[''to come back to life after having once died'']'
ἐγκαθήμαι	'[''Physical Events and States'']'	'[''Sit'', ''Remain, Stay'']'	to sit down or remain settled in a place
εγκαινιζω	'[''Be, Become, Exist, Happen'']'	'[''Exist'']'	'[''to cause something to go into effect, with the implication of something being newly established'']'
ἐγκαινισμός	'[''Religious Activities'']'	'[''Dedicate, Consecrate'', ''Holy, Pure'', ''Holy, Pure'']'	a ceremony of setting apart something as sacred
εγκατα	'[''Body, Body Parts, and Body Products'']'	'[''Parts of the Body'']'	inward parts, entrails
ἐγκατάλειμμα	'[''Moral and Ethical Qualities and Related Behavior'']'	'[''Remnant'']'	what is left over or survives
εγκαταλειπω	'[''Be, Become, Exist, Happen'', ''Help, Care For'', ''Aspect'']'	'[''Exist'', ''Desert, Forsake'', ''Cease, Stop'']'	'[''to cause to continue to exist, normally referring to a small part of a larger whole'', ''to desert or forsake a person and thus leave that individual uncared for'', ''to cease from an activity which has gone on for some time'']'
ἐγκαταλιμπάνω	'[''Behavior and Related States'']'	'[''Expose Oneself to Danger'']'	to leave someone or something behind
εγκατον	'[''Number'']'	'[''Number, Countless'']'	the number one hundred
εγκαυχαομαι	'[''Communication'']'	'[''Boast'']'	'[''to express an unusually high degree of confidence in someone or something being exceptionally noteworthy{N:001}'']'
ἐγκοτέω	'[''Attitudes and Emotions'']'	'[''Anger, Be Indignant With'']'	to harbor resentment or ill-will
εγω	'[''Discourse Referentials'', ''Discourse Referentials'']'	'[''Speaker'', ''Speaker and Those Associated with the Speaker [exclusive and inclusive]'']'	'[''a reference to the speaker (with an added feature of emphasis in the form ἐγώ)'', ''a reference to the speaker or writer and those associated with him or her, either including or excluding the audience (with an added feature of emphasis in the form ἡμεῖς)'']'
εδαφιζω	'[''Violence, Harm, Destroy, Kill'', ''Violence, Harm, Destroy, Kill'']'	'[''Destroy'', ''Kill'']'	'[''(derivative of {L:ἔδαφος<SDBG:ἔδαφος:000000>} ‘ground,’ {D:1.44}) to destroy or tear down, by causing something to be brought down to the level of the ground'', ''(a figurative extension of meaning of {L:ἐδαφίζω<SDBG:ἐδαφίζω:000000>}[a] ‘to raze, to tear down,’ {D:20.57}) to destroy or kill a population'']'
εδαφος	'[''Geographical Objects and Features'']'	'["The Earth''s Surface"]'	'[''the surface of the earth'']'
εδεσμα	'[''Foods and Condiments'']'	'[''Food'']'	a delicacy, dish, or item of food
εδωμ	'[''Names of Persons and Places'']'	'[''Places'']'	Nation descended from Esau, south of Dead Sea
εθνος	'[''Groups and Classes of Persons and Members of Such Groups and Classes'', ''Groups and Classes of Persons and Members of Such Groups and Classes'']'	'[''Socio-Political'', ''Socio-Religious'']'	'[''the largest unit into which the people of the world are divided on the basis of their constituting a socio-political community'', ''(an extended meaning of {L:ἔθνος<SDBG:ἔθνος:000000>} ‘nation,’ {D:11.55}) those who do not belong to the Jewish or Christian faith'']'
ει	'[''Relations'', ''Relations'', ''Case'', ''Relations'', ''Discourse Markers'', ''Mode'']'	'[''Condition'', ''Cause and/or Reason'', ''Content'', ''Contrast'', ''Markers of Emphasis'', ''Probable, Improbable'']'	'[''a marker of a condition, real or hypothetical, actual or contrary to fact'', ''a marker of cause or reason on the basis that an actual case is regarded formally as a supposition'', ''a marker of an indirect question as content'', ''a marker of contrast by designating an exception'', ''a marker of considerable emphasis (in comparison with {L:δήπου<SDBG:δήπου:000001>}[b], {D:91.7})'', ''(an idiom, literally: if it should happen) a marker of a degree of probability'']'
ειδωλον	'[''Artifacts'', ''Supernatural Beings and Powers'']'	'[''Images and Idols'', ''Supernatural Beings'']'	'[''an object which resembles a person, animal, god, etc. and which is an object of worship{N:001}'', ''(a figurative extension of meaning of {L:εἴδωλον<SDBG:εἴδωλον:000000>}[a] ‘idol,’ {D:6.97}) an unreal supernatural being'']'
εικων	'[''Artifacts'', ''Nature, Class, Example'', ''Nature, Class, Example'']'	'[''Images and Idols'', ''Same or Equivalent Kind or Class'', ''Pattern, Model, Example, and Corresponding Representation'']'	'[''an object (not necessarily three-dimensional) which has been formed to resemble a person, god, animal, etc.'', ''that which has the same form as something else'', ''that which represents something else in terms of basic form and features'']'
ειμι	'[''Be, Become, Exist, Happen'', ''Be, Become, Exist, Happen'', ''Be, Become, Exist, Happen'', ''Be, Become, Exist, Happen'', ''Existence in Space'', ''Mode'', ''Nature, Class, Example'', ''Nature, Class, Example'', ''Be, Become, Exist, Happen'', ''Association'', ''Aspect'', ''Physiological Processes and States'', ''Status'', ''Status'', ''Relations'', ''Physiological Processes and States'']'	'[''State'', ''State'', ''Exist'', ''Happen'', ''Be in a Place'', ''Possible, Impossible'', ''Archetype, Corresponding Type [Antitype]'', ''Archetype, Corresponding Type [Antitype]'', ''Change of State'', ''Associate'', ''Continue'', ''Live, Die'', ''High Status or Rank [including persons of high status]'', ''Slave, Free'', ''Equivalence'', ''Live, Die'']'	'[''to possess certain characteristics, whether inherent or transitory'', ''to be identical with'', ''to exist, in an absolute sense'', ''to occur, of an event'', ''to be in a place'', ''to mark an event as being possible in a highly generic sense'', ''to belong to a particular class'', ''to correspond to something else in certain significant features'', ''to change from one state to another'', ''(an idiom, literally: to be in the bosom of) to be closely and intimately associated, with the implication of strong affection for'', ''(an idiom, literally: to be in) to continue to perform certain activities with care and concern'', ''(an idiom, literally: to be in death) to be in imminent danger of dying'', ''(an idiom, literally: to be someone) to be an important person'', ''(an idiom, literally: to be under a yoke) to be in a state of slavery'', ''a marker of an explanation or a clarification in the same or a different language'', ''(an idiom, literally: to be in a dwelling, see {D:7.8}) to be alive, with special emphasis upon physical existence on earth'']'
ειμι	'[''Be, Become, Exist, Happen'', ''Be, Become, Exist, Happen'', ''Be, Become, Exist, Happen'', ''Be, Become, Exist, Happen'', ''Existence in Space'', ''Mode'', ''Nature, Class, Example'', ''Nature, Class, Example'', ''Be, Become, Exist, Happen'', ''Association'', ''Aspect'', ''Physiological Processes and States'', ''Status'', ''Status'', ''Relations'', ''Physiological Processes and States'']'	'[''State'', ''State'', ''Exist'', ''Happen'', ''Be in a Place'', ''Possible, Impossible'', ''Archetype, Corresponding Type [Antitype]'', ''Archetype, Corresponding Type [Antitype]'', ''Change of State'', ''Associate'', ''Continue'', ''Live, Die'', ''High Status or Rank [including persons of high status]'', ''Slave, Free'', ''Equivalence'', ''Live, Die'']'	'[''to possess certain characteristics, whether inherent or transitory'', ''to be identical with'', ''to exist, in an absolute sense'', ''to occur, of an event'', ''to be in a place'', ''to mark an event as being possible in a highly generic sense'', ''to belong to a particular class'', ''to correspond to something else in certain significant features'', ''to change from one state to another'', ''(an idiom, literally: to be in the bosom of) to be closely and intimately associated, with the implication of strong affection for'', ''(an idiom, literally: to be in) to continue to perform certain activities with care and concern'', ''(an idiom, literally: to be in death) to be in imminent danger of dying'', ''(an idiom, literally: to be someone) to be an important person'', ''(an idiom, literally: to be under a yoke) to be in a state of slavery'', ''a marker of an explanation or a clarification in the same or a different language'', ''(an idiom, literally: to be in a dwelling, see {D:7.8}) to be alive, with special emphasis upon physical existence on earth'']'
ειρηνη	'[''Trouble, Hardship, Relief, Favorable Circumstances'', ''Attitudes and Emotions'']'	'[''Favorable Circumstances or State'', ''Worry, Anxiety, Distress, Peace'']'	'[''a set of favorable circumstances involving peace and tranquility'', ''a state of freedom from anxiety and inner turmoil{N:001}'']'
ειρηνικος	'[''Attitudes and Emotions'']'	'[''Worry, Anxiety, Distress, Peace'']'	'[''pertaining to freedom from anxiety and inner turmoil'']'
εις	'[''Spacial Extensions'', ''Spacial Extensions'', ''Spacial Positions'', ''Spacial Positions'', ''Spacial Positions'', ''Relations'', ''Relations'', ''Relations'', ''Case'', ''Degree'', ''Be, Become, Exist, Happen'', ''Case'', ''Case'', ''Case'', ''Time'', ''Time'', ''Time'', ''Learn'', ''Understand'', ''Degree'', ''Time'', ''Know'', ''Physiological Processes and States'', ''Moral and Ethical Qualities and Related Behavior'']'	'[''Extension To a Goal'', ''Extension To a Goal'', ''On, Upon, On the Surface Of'', ''Among, Between, In, Inside'', ''Among, Between, In, Inside'', ''Purpose'', ''Result'', ''Means'', ''Content'', ''Up To, As Much As, To the Degree That [Marked Extent of Degree]'', ''Change of State'', ''Experiencer'', ''Benefaction'', ''Guarantor Participant with Oaths'', ''Duration of Time without Reference to Points or Units of Time: Time, Spend Time, Always, Eternal, Old, Immediately, Young'', ''Indefinite Units of Time: Age, Lifetime, Interval, Period'', ''Duration of Time with Reference to Some Point of Time: Until, Delay, Still, From'', ''Learn'', ''Come To Understand'', ''Much, Little [Positive-Negative Degree]'', ''Duration of Time without Reference to Points or Units of Time: Time, Spend Time, Always, Eternal, Old, Immediately, Young'', ''Not Able To Be Known, Secret'', ''Sickness, Disease, Weakness'', ''Envy, Jealousy'']'	'[''extension toward a special goal{N:001}'', ''extension toward a goal which is inside an area'', ''a position on the surface of an area'', ''a position defined as being within certain limits{N:002}'', ''a position within an area determined by other objects and distributed among such objects{N:003}'', ''a marker of intent, often with the implication of expected result'', ''a marker of result, with the probable implication of a preceding process'', ''a marker of the means by which one event makes another event possible{N:004}'', ''(with the accusative) a marker of content as a means of specifying a particular referent'', ''a degree extending to a particular point as marked by the context'', ''a marker of a change of state'', ''a marker of an involved experiencer'', ''(with the accusative) a marker of persons benefited by an event, with the implication of something directed to them'', ''(with the dative) a marker of objects which serve as symbolic substitutes for supernatural persons or powers presumed to act as guarantors of compliance with oaths'', ''a marker of an extent of time'', ''a marker of a unit of time'', ''the continuous extent of time up to a point'', ''(an idiom, literally: to come into knowledge) to acquire information about something, with emphasis upon the process involved'', ''(an idiom, literally: to come into knowledge) to come to understand the meaning of something, with special emphasis upon the process'', ''(an idiom, literally: into that which is not measured) a point on a scale going beyond what is expected'', ''unlimited duration of time, with particular focus upon the future'', ''(an idiom, literally: into the ear) pertaining to what is known only by those who hear a particular message in private'', ''(an idiom, literally: to come to the worse) to become increasingly more sick'', ''(an idiom, literally: to be in the gall of bitterness) to be particularly envious or resentful of someone'']'
εις	'[''Spacial Extensions'', ''Spacial Extensions'', ''Spacial Positions'', ''Spacial Positions'', ''Spacial Positions'', ''Relations'', ''Relations'', ''Relations'', ''Case'', ''Degree'', ''Be, Become, Exist, Happen'', ''Case'', ''Case'', ''Case'', ''Time'', ''Time'', ''Time'', ''Learn'', ''Understand'', ''Degree'', ''Time'', ''Know'', ''Physiological Processes and States'', ''Moral and Ethical Qualities and Related Behavior'']'	'[''Extension To a Goal'', ''Extension To a Goal'', ''On, Upon, On the Surface Of'', ''Among, Between, In, Inside'', ''Among, Between, In, Inside'', ''Purpose'', ''Result'', ''Means'', ''Content'', ''Up To, As Much As, To the Degree That [Marked Extent of Degree]'', ''Change of State'', ''Experiencer'', ''Benefaction'', ''Guarantor Participant with Oaths'', ''Duration of Time without Reference to Points or Units of Time: Time, Spend Time, Always, Eternal, Old, Immediately, Young'', ''Indefinite Units of Time: Age, Lifetime, Interval, Period'', ''Duration of Time with Reference to Some Point of Time: Until, Delay, Still, From'', ''Learn'', ''Come To Understand'', ''Much, Little [Positive-Negative Degree]'', ''Duration of Time without Reference to Points or Units of Time: Time, Spend Time, Always, Eternal, Old, Immediately, Young'', ''Not Able To Be Known, Secret'', ''Sickness, Disease, Weakness'', ''Envy, Jealousy'']'	'[''extension toward a special goal{N:001}'', ''extension toward a goal which is inside an area'', ''a position on the surface of an area'', ''a position defined as being within certain limits{N:002}'', ''a position within an area determined by other objects and distributed among such objects{N:003}'', ''a marker of intent, often with the implication of expected result'', ''a marker of result, with the probable implication of a preceding process'', ''a marker of the means by which one event makes another event possible{N:004}'', ''(with the accusative) a marker of content as a means of specifying a particular referent'', ''a degree extending to a particular point as marked by the context'', ''a marker of a change of state'', ''a marker of an involved experiencer'', ''(with the accusative) a marker of persons benefited by an event, with the implication of something directed to them'', ''(with the dative) a marker of objects which serve as symbolic substitutes for supernatural persons or powers presumed to act as guarantors of compliance with oaths'', ''a marker of an extent of time'', ''a marker of a unit of time'', ''the continuous extent of time up to a point'', ''(an idiom, literally: to come into knowledge) to acquire information about something, with emphasis upon the process involved'', ''(an idiom, literally: to come into knowledge) to come to understand the meaning of something, with special emphasis upon the process'', ''(an idiom, literally: into that which is not measured) a point on a scale going beyond what is expected'', ''unlimited duration of time, with particular focus upon the future'', ''(an idiom, literally: into the ear) pertaining to what is known only by those who hear a particular message in private'', ''(an idiom, literally: to come to the worse) to become increasingly more sick'', ''(an idiom, literally: to be in the gall of bitterness) to be particularly envious or resentful of someone'']'
εισαγω	'[''Linear Movement'', ''Linear Movement'']'	'[''Lead, Bring, Take'', ''Carry, Bear'']'	'[''to bring or lead into'', ''to carry or bring something into an area or structure'']'
εισακουω	'[''Sensory Events and States'', ''Guide, Discipline, Follow'']'	'[''Hear'', ''Obey, Disobey'']'	'[''to listen to someone, with the implication of heeding and responding to what is heard'', ''to obey on the basis of having paid attention to{N:001}'']'
εισερχομαι	'[''Linear Movement'', ''Be, Become, Exist, Happen'', ''Aspect'', ''Case'', ''Behavior and Related States'']'	'[''Come/Go Into'', ''Happen'', ''Begin, Start'', ''Experiencer'', ''Behavior, Conduct'']'	'[''to move into a space, either two-dimensional or three-dimensional'', ''to happen, with the focus upon the initial aspect'', ''to begin, with the focus upon the initial stages of an activity'', ''to begin to experience an event or state'', ''(idiom, literally: to go in and to go out) to live or to conduct oneself in relationship to some community or group'']'
εισοδος	'[''Linear Movement'', ''Association'']'	'[''Come, Come To, Arrive'', ''Welcome, Receive'']'	'[''to come to or to arrive at the scene of action'', ''welcome extended to a person on the occasion of a visit, with probable focus upon the ready acceptance'']'
εισπορευομαι	'[''Linear Movement'', ''Behavior and Related States'']'	'[''Come/Go Into'', ''Behavior, Conduct'']'	'[''to move into a space, either two-dimensional or three-dimensional'', ''(idiom, literally: to go in and to go out) to live or to conduct oneself in relationship to some community or group'']'
