lemma	domains	subdomains	definitions
καταλειπω	'[''Linear Movement'', ''Existence in Space'', ''Be, Become, Exist, Happen'', ''Think'', ''Association'', ''Help, Care For'']'	'[''Leave, Depart, Flee, Escape, Send'', ''Leave in a Place'', ''Exist'', ''To Think About, with the Implied Purpose of Responding Appropriately'', ''Limit or Avoid Association'', ''Help'']'	'[''to leave or depart, with emphasis on the finality of the action'', ''to cause or permit something to remain in a place and to go away (with or without implying purpose)'', ''to cause to continue to exist, normally referring to a small part of a larger whole'', ''to give up or neglect one’s concern for something'', ''to cause a particular relationship to cease'', ''to leave someone without help (possibly in the sense of ‘to cease helping’)'']'
καταλοιπος	'[''Whole, Unite, Part, Divide'']'	'[''Remnant'']'	'[''pertaining to the part of a whole which remains or continues, and thus constitutes the rest of the whole{N:001}'']'
καταλυω	'[''Violence, Harm, Destroy, Kill'', ''Violence, Harm, Destroy, Kill'', ''Be, Become, Exist, Happen'', ''Power, Force'', ''Association'']'	'[''Destroy'', ''Destroy'', ''Exist'', ''Show Hospitality'']'	'[''to destroy completely by tearing down and dismantling'', ''to destroy completely the efforts or work of someone else'', ''to cause to cease to exist'', ''to completely invalidate something which has been in force'', ''to experience the hospitality of someone, with principal focus upon lodging'']'
κατανέμω	'[''Physical Events and States'']'	'[''Distribution'']'	to distribute or allocate to different recipients
κατανοεω	'[''Think'', ''Think'', ''Understand'', ''Sensory Events and States'']'	'[''To Think, Thought'', ''To Think About, with the Implied Purpose of Responding Appropriately'', ''Come To Understand'', ''See'']'	'[''to give very careful consideration to some matter{N:001}'', ''to give proper and decisive thought about something'', ''to come to a clear and definite understanding of something'', ''to discover something through direct observation, with the implication of also thinking about it'']'
καταντήμα	'[''Linear Movement'', ''Linear Movement'']'	'[''Here, There'']'	the place to which one arrives, point of arrival
κατανυξις	'[''Think'']'	'[''To Think, Thought'']'	'[''a state of not being able to think satisfactorily because of complete bewilderment and stupor'']'
κατανύσσω	'[''Physical Events and States'']'	'[''Pierce, Cut'', ''Parts of the Body'']'	to pierce or penetrate (often figuratively, e.g., the heart)
καταπανουργεύομαι	'[''Moral and Ethical Qualities and Related Behavior'']'	'[''Mislead, Lead Astray, Deceive'']'	to act with cunning or trickery
καταπατεω	'[''Physical Impact'', ''Moral and Ethical Qualities and Related Behavior'']'	'[''Press'', ''Despise, Scorn, Contempt'']'	'[''to step down forcibly upon, often with the implication of destruction or ruin'', ''(a figurative extension of meaning of {L:καταπατέω<SDBG:καταπατέω:000000>}[a] ‘to trample on,’ {D:19.52}) to thoroughly despise someone or something'']'
καταπαυσις	'[''Physiological Processes and States'']'	'[''Tire, Rest'']'	'[''to cease one’s work or activity, resulting in a period of rest'']'
καταπαυω	'[''Physiological Processes and States'', ''Physiological Processes and States'', ''Aspect'']'	'[''Tire, Rest'', ''Tire, Rest'', ''Cease, Stop'']'	'[''to cease one’s work or activity, resulting in a period of rest'', ''to cause someone to cease from activity and as a result to enjoy a period of rest'', ''to cause something or someone to cease from some activity or state{N:001}'']'
καταπινω	'[''Physiological Processes and States'', ''Violence, Harm, Destroy, Kill'', ''Be, Become, Exist, Happen'', ''Attitudes and Emotions'']'	'[''Processes Involving the Mouth, Other Than Eating and Drinking'', ''Destroy'', ''State'', ''Sorrow, Regret'']'	'[''to cause something to pass through the mouth and into the stomach'', ''(a figurative extension of meaning of {L:καταπίνω<SDBG:καταπίνω:000000>}[a] ‘to swallow,’ {D:23.45}) to cause the complete and sudden destruction of someone or something'', ''(a figurative extension of meaning of {L:καταπίνω<SDBG:καταπίνω:000000>}[a] ‘to swallow,’ {D:23.45}) to cause the complete cessation of a state'', ''(an idiom, literally: to be swallowed up by grief) to be so overcome with grief as to despair{N:001}'']'
καταπιπτω	'[''Linear Movement'', ''Linear Movement'']'	'[''Fall'', ''Fall'']'	'[''to fall from one level to another{N:001}'', ''to fall from a standing or upright position down to the ground or surface{N:001}'']'
καταποντιζω	'[''Linear Movement'', ''Linear Movement'']'	'[''Come/Go Down, Descend'', ''Come/Go Down, Descend'']'	'[''to cause something or someone to sink into deep water'', ''to sink down into deep water'']'
καταποντισμός	'[''Physical Events and States'']'	'[''Bodies of Water'', ''Destroy'']'	a flood or overwhelming destruction by water
καταπραΰνω	'[''Attitudes and Emotions'']'	'[''Peaceful Behavior'']'	to soothe or reduce agitation, to calm down
κατάπτωμα	'[''Physical Events and States'']'	'[''Fall'']'	a fall, collapse, or descent
καταρα	'[''Communication'', ''Communication'', ''Communication'']'	'[''Bless, Curse'', ''Bless, Curse'', ''Bless, Curse'']'	'[''to cause injury or harm by means of a statement regarded as having some supernatural power, often because a deity or supernatural force has been evoked'', ''the content of what is expressed in a curse'', ''that which has been cursed'']'
καταραομαι	'[''Communication'']'	'[''Bless, Curse'']'	'[''to cause injury or harm by means of a statement regarded as having some supernatural power, often because a deity or supernatural force has been evoked'']'
καταρράκτης	'[''Physical Events and States'']'	'[''Bodies of Water'', ''Movement of Liquids or Masses'']'	a waterfall or cataract
καταρράσσω	'[''Physical Events and States'']'	'[''Throw, Hurl'', ''Fall'']'	to dash or throw down violently
καταρρήγνυμι	'[''Physical Events and States'']'	'[''Break, Break Through'']'	to tear or break apart forcefully
καταρτιζω	'[''Adequate, Qualified'', ''Be, Become, Exist, Happen'', ''Perform, Do'']'	'[''Happen'', ''Make, Create'']'	'[''to make someone completely adequate or sufficient for something'', ''to cause to happen by means of some arrangement'', ''to create, with the implication of putting into proper condition'']'
κατασκηνοω	'[''Artifacts'']'	'[''Containers'']'	'[''(derivative of {L:κατασκήνωσις<SDBG:κατασκήνωσις:000000>} ‘nest,’ {D:6.146}) to make a nest (or possibly to find shelter)'']'
καταστρεφω	'[''Non-Linear Movement'']'	'[''Change of State'']'	'[''to cause something to be completely overturned'']'
κατασχεσις	'[''Possess, Transfer, Exchange'', ''Possess, Transfer, Exchange'']'	'[''Have, Possess, Property, Owner'', ''Take, Obtain, Gain, Lose'']'	'[''to have or possess objects or property (in the technical sense of having control over the use of such objects){N:001}{N:002}'', ''the act of taking possession of something'']'
κατατιθημι	'[''Case'']'	'[''Experiencer'']'	'[''to experience, with the implication of something having been bestowed upon'']'
κατατοξεύω	'[''Physical Events and States'']'	'[''Weapons and Armor'']'	to shoot with a bow and arrow
κατατρυφάω	'[''Attitudes and Emotions'']'	'[''Extravagant Living, Intemperate Living'']'	to live in luxury or overindulgence
καταφευγω	'[''Linear Movement'', ''Danger, Risk, Safe, Save'']'	'[''Leave, Depart, Flee, Escape, Send'', ''Become Safe, Free from Danger'']'	'[''to flee from an area, with probably greater intensity than in the case of {L:φεύγω<SDBG:φεύγω:000000>}[a] and {L:φυγή<SDBG:φυγή:000000>} ({D:15.61})'', ''to become safe by taking refuge'']'
καταφθορά	'[''Moral and Ethical Qualities and Related Behavior'']'	'[''Destroy'']'	destruction, decay, or corruption, especially moral
καταφιλεω	'[''Association'']'	'[''Kiss, Embrace'']'	'[''to kiss, either as an expression of greeting or as a sign of special affection and appreciation{N:001}'']'
καταφλέγω	'[''Physical Events and States'']'	'[''Burning'', ''Fire'']'	to burn or consume completely with fire
καταφλογίζω	'[''Physical Events and States'']'	'[''Burning'']'	to set something on fire intensely
καταφυγή	'[''Names of Persons and Places'']'	'[''Places'']'	a shelter or safe place from danger
καταφυτεύω	'[''Agriculture'']'	'[''Plants That Are Not Trees'']'	to plant or establish (e.g., a vineyard or people)
καταχεω	'[''Activities Involving Liquids or Masses'']'	'[''Movement of Liquids or Masses'']'	'[''to cause to pour down on'']'
κατεναντι	'[''Spacial Positions'', ''Case'']'	'[''Opposite, Over Against, Across From, Offshore From'', ''Viewpoint Participant'']'	'[''a position over against an object or other position'', ''(with the genitive) marking a participant whose viewpoint is relevant to an event{N:002}'']'
κατεναντίον	'[''Spacial Positions'']'	'[''In Front Of, Face To Face, In Back Of, Behind'', ''Opposite, Over Against, Across From, Offshore From'']'	opposite to, in front of, or facing someone or something
κατεργαζομαι	'[''Perform, Do'', ''Case'', ''Be, Become, Exist, Happen'', ''Ready, Prepared'']'	'[''Do, Perform'', ''Agent of a Numerable Event'', ''State'']'	'[''to do something with success and/or thoroughness'', ''a marker of an agent relation with numerable events, with the probable implication of comprehensiveness'', ''to cause a state to be{N:001}'', ''to cause to be thoroughly prepared'']'
κατεσθιω	'[''Physiological Processes and States'', ''Violence, Harm, Destroy, Kill'', ''Possess, Transfer, Exchange'', ''Possess, Transfer, Exchange'', ''Moral and Ethical Qualities and Related Behavior'']'	'[''Eat, Drink'', ''Destroy'', ''Steal, Rob'', ''Spend, Waste'', ''Exploit'']'	'[''to devour something completely'', ''(a figurative extension of meaning of {L:κατεσθίω<SDBG:κατεσθίω:000000>}[a] ‘to eat up,’ {D:23.11}) to destroy completely (in a sense more emphatic than {L:ἐσθίω<SDBG:ἐσθίω:000001>}[b], {D:20.44})'', ''(a figurative extension of meaning of {L:κατεσθίω<SDBG:κατεσθίω:000000>}[a] ‘to eat up, to consume,’ {D:23.11}) to take over by dishonest means the property of someone else'', ''(a figurative extension of meaning of {L:κατεσθίω<SDBG:κατεσθίω:000000>}[a] ‘to eat up, to consume,’ {D:23.11}) to spend or use up excessively and uselessly'', ''(a figurative extension of meaning of {L:κατεσθίω<SDBG:κατεσθίω:000000>}[a] ‘to eat up,’ {D:23.11}) to take total advantage of someone'']'
κατευθυνω	'[''Guide, Discipline, Follow'', ''Behavior and Related States'']'	'[''Guide, Lead'', ''Behavior, Conduct'']'	'[''to so influence others as to cause them to follow a recommended course of action'', ''(an idiom, literally: to guide the feet properly) to guide or direct behavior in an appropriate manner'']'
κατευοδόω	'[''Behavior and Related States'']'	'[''Cause To Be Safe, Free from Danger'']'	to cause to prosper or lead to success
κατεχω	'[''Be, Become, Exist, Happen'', ''Hold a View, Believe, Trust'', ''Possess, Transfer, Exchange'', ''Control, Rule'', ''Existence in Space'', ''Maritime Activities'']'	'[''Happen'', ''Believe To Be True'', ''Have, Possess, Property, Owner'', ''Control, Restrain'', ''Be in a Place'']'	'[''to prevent someone from doing something by restraining or hindering'', ''to continue to believe, with the implication of acting in accordance with such belief'', ''to have or possess objects or property (in the technical sense of having control over the use of such objects){N:001}{N:002}'', ''to exercise continuous control over someone or something'', ''to come to occupy a particular place'', ''(a nautical idiom, literally: to control toward) to control the movement of a ship to a particular point'']'
κατισχυω	'[''Able, Capable'', ''Features of Objects'', ''Hostility, Strife'']'	'[''Strong, Weak'', ''Conquer'']'	'[''to be completely capable of doing or experiencing something'', ''to be physically strong enough for some purpose'', ''to prevail over something or some person so as to be able to defeat, with the implication that the successful participant has greater strength'']'
κατοικεσία	'[''Artifacts'']'	'[''Dwell, Reside'']'	a place where one lives or resides
κατοικεω	'[''Existence in Space'']'	'[''Dwell, Reside'']'	'[''to live or dwell in a place in an established or settled manner'']'
κατοικητηριον	'[''Existence in Space'']'	'[''Dwell, Reside'']'	'[''(derivative of {L:κατοικέω<SDBG:κατοικέω:000000>} ‘to dwell,’ {D:85.69}) a place of dwelling, whether an object or area{N:001}'']'
κατοικια	'[''Existence in Space'']'	'[''Dwell, Reside'']'	'[''(derivative of {L:κατοικέω<SDBG:κατοικέω:000000>} ‘to dwell,’ {D:85.69}) a place of dwelling, whether an object or area{N:001}'']'
κατοικιζω	'[''Existence in Space'']'	'[''Dwell, Reside'']'	'[''(a figurative extension of meaning of κατοικίζω ‘to cause to dwell,’ not occurring in the NT) to cause to be in a place defined psychologically or spiritually'']'
κάτοικος	'[''Relations'']'	'[''Dwell, Reside'']'	one who lives in a particular place
κατορθόω	'[''Behavior and Related States'']'	'[''Complete, Finish, Succeed'']'	to accomplish or complete something well
κατορθωσις	'[''Behavior and Related States'']'	'[''Complete, Finish, Succeed'']'	the act of achieving something successfully
κατώτατος	'[''Spacial Positions'']'	'[''High, Low, Deep'']'	the lowest or bottommost position
καυχαομαι	'[''Communication'']'	'[''Boast'']'	'[''to express an unusually high degree of confidence in someone or something being exceptionally noteworthy{N:001}'']'
καυχημα	'[''Communication'', ''Communication'', ''Communication'', ''Attitudes and Emotions'']'	'[''Boast'', ''Boast'', ''Boast'', ''Pride [legitimate]'']'	'[''to express an unusually high degree of confidence in someone or something being exceptionally noteworthy{N:001}'', ''(derivative of {L:καυχάομαι<SDBG:καυχάομαι:000000>} ‘to boast,’ {D:33.368}) the referent of boasting, namely, that which one boasts about'', ''the justification for boasting'', ''the basis for or the content of one’s feeling of legitimate pride'']'
κβʹ	'[''Number'']'	'[''Number, Countless'']'	the twenty-second (ordinal numeral)
κέδρος	'[''Plants'']'	'[''Trees'', ''Fragrance, Odor'']'	a tall, fragrant evergreen tree
κενος	'[''Possess, Transfer, Exchange'', ''Understand'', ''Relations'', ''Relations'', ''True, False'']'	'[''Need, Lack'', ''Lack of Capacity for Understanding'', ''Result'', ''Purpose'', ''True, False'']'	'[''pertaining to being without anything'', ''(a figurative extension of meaning of {L:κενός<SDBG:κενός:000000>}[a] ‘empty,’ {D:57.42}) pertaining to a complete lack of understanding and insight'', ''pertaining to being lacking in results'', ''pertaining to being totally without purpose'', ''pertaining to being untrue in view of lacking truth'']'
κεραμευς	'[''Artifacts'']'	'[''Containers'']'	'[''(derivative of {L:κεράμιον<SDBG:κεράμιον:000000>} ‘earthenware vessel,’ {D:6.128}) one who makes earthenware vessels'']'
κερας	'[''Body, Body Parts, and Body Products'', ''Features of Objects'', ''Power, Force'']'	'[''Parts of the Body'', ''Shapes'']'	'[''the hard bony outgrowth on the heads of certain animals'', ''a projection at the corner of an object'', ''(a figurative extension of meaning of {L:κέρας<SDBG:κέρας:000000>}[a] ‘horn,’ {D:8.17}) power of unusual significance'']'
κέρασμα	'[''Foods and Condiments'']'	'[''Food'']'	a beverage, especially a blended or spiced drink
κερατίζω	'[''Physical Events and States'']'	'[''Animals'', ''Pierce, Cut'']'	to gore or thrust with horns, as an animal attack
κερατίνη	'[''Artifacts'', ''Artifacts'']'	'[''Musical Instruments'', ''Musical Instruments'']'	a musical instrument made from or shaped like a horn
κεφαλη	'[''Body, Body Parts, and Body Products'', ''Status'', ''Constructions'', ''Physiological Processes and States'', ''Activities Involving Clothing and Adorning'']'	'[''Parts of the Body'', ''High Status or Rank [including persons of high status]'', ''Parts and Areas of Buildings'', ''Tire, Rest'']'	'[''uppermost part of the human body, or the front or upper part of the body of an animal, typically separated from the rest of the body by a neck, and containing the brain, mouth, and sense organs; associated with the entire person, that person’s life and responsibilities'', ''(a figurative extension of meaning of {L:κεφαλή<SDBG:κεφαλή:000000>}[a] ‘head,’ {D:8.10}) one who is of supreme or pre-eminent status, in view of authority to order or command'', ''(a set phrase, literally: head of the corner) the cornerstone or capstone of a building, essential to its construction (κεφαλὴ γωνίας occurs in the NT only figuratively in reference to Christ)'', ''(an idiom, literally: to lay down the head) to experience the rest which comes from sleep'', ''(an idiom, literally: to have down on the head) to wear a covering over one’s head'']'
κεφαλις	'[''Artifacts'']'	'[''Instruments Used in Marking and Writing'']'	'[''section of a scroll or of a long composition'']'
κηδαρ	'[''Names of Persons and Places'']'	'[''Places'']'	Nomadic tribe descended from Ishmael
κῆμος	'[''Artifacts'']'	'[''Control, Restrain'']'	a device to restrain the mouth, e.g. of an animal
κηριον	'[''Foods and Condiments'']'	'[''Food'']'	'[''None'']'
κηρός	'[''Natural Substances'']'	'[''Non-Fruit Parts of Plants'']'	a soft, pliable substance from bees or plants
κιβωτος	'[''Artifacts'', ''Artifacts'']'	'[''Boats and Parts of Boats'', ''Containers'']'	'[''a large box-like structure (the vessel built by Noah)'', ''any box-like container, whether plain or elaborate; here, refers to the box used to hold the tablets of the Law'']'
κιθαρα	'[''Artifacts'']'	'[''Musical Instruments'']'	'[''a small stringed harp-like instrument held in the hands and plucked'']'
κινδυνος	'[''Danger, Risk, Safe, Save'']'	'[''Danger'']'	'[''a state of dangerous and threatening circumstances'']'
κινεω	'[''Linear Movement'', ''Linear Movement'', ''Non-Linear Movement'', ''Hostility, Strife'', ''Case'']'	'[''Move, Come/Go'', ''Move, Come/Go'', ''Riot'', ''Agent in a Causative Role Marked by Verbs'']'	'[''to make a change of location in space (a highly generic meaning)'', ''to cause something to be moved from a place'', ''to set something in motion, with the nature of the movement dependent upon the object in question'', ''to cause people to riot against'', ''a marker of a causative relation, with the implication of significant activity'']'
κινησις	'[''Non-Linear Movement'']'	'[''Movement of Liquids or Masses'']'	'[''the motion of a solid or mass, without indication of movement in space'']'
κίρναω	'[''Foods and Condiments'']'	'[''Mix'']'	to mix or blend especially liquids, such as wine
κισσάω	'[''Physiological Processes and States'']'	'[''Desire Strongly'', ''Desire, Want, Wish'']'	to long for or crave intensely
κισων	'[''Names of Persons and Places'']'	'[''Places'']'	River in northern Israel where Sisera was defeated
κιχράω	'[''Possess, Transfer, Exchange'']'	'[''Give'']'	to lend or give on loan temporarily
κλαιω	'[''Attitudes and Emotions'']'	'[''Laugh, Cry, Groan'']'	'[''to weep or wail, with emphasis upon the noise accompanying the weeping'']'
κλαυθμος	'[''Attitudes and Emotions'']'	'[''Laugh, Cry, Groan'']'	'[''to weep or wail, with emphasis upon the noise accompanying the weeping'']'
κλαυθμών	'[''Attitudes and Emotions'']'	'[''Laugh, Cry, Groan'']'	a place or act of loud weeping or mourning
κλεπτης	'[''Possess, Transfer, Exchange'']'	'[''Steal, Rob'']'	'[''(derivative of {L:κλέπτω<SDBG:κλέπτω:000000>} ‘to steal,’ {D:57.232}) a person who steals'']'
κλημα	'[''Plants'']'	'[''Non-Fruit Parts of Plants'']'	'[''a more or less tender, flexible branch, as of a vine'']'
κληροδοσία	'[''Possess, Transfer, Exchange'']'	'[''Give'']'	the act of passing on property or inheritance by allotment
κληροδοτέω	'[''Possess, Transfer, Exchange'']'	'[''Give'']'	to bestow or assign property by casting lots
κληρονομεω	'[''Possess, Transfer, Exchange'', ''Possess, Transfer, Exchange'']'	'[''Receive'', ''Receive'']'	'[''to receive something of considerable value which has not been earned'', ''to receive a possession or benefit as a gift from someone who has died, generally a parent'']'
κληρονομια	'[''Possess, Transfer, Exchange'', ''Possess, Transfer, Exchange'']'	'[''Receive'', ''Receive'']'	'[''(derivative of {L:κληρονομέω<SDBG:κληρονομέω:000000>}[a] ‘to gain as a possession,’ {D:57.131}) a valuable possession which has been received'', ''(derivative of {L:κληρονομέω<SDBG:κληρονομέω:000001>}[b] ‘to inherit,’ {D:57.138}) that which is received from a deceased person'']'
κληρος	'[''Artifacts'', ''Possess, Transfer, Exchange'', ''Control, Rule'', ''Help, Care For'', ''Whole, Unite, Part, Divide'', ''Think'']'	'[''Miscellaneous'', ''Give'', ''Assign to a Role or Function'', ''Entrust To the Care Of'', ''Part'', ''To Choose, To Select, To Prefer'']'	'[''a specially marked pebble, piece of pottery, or stick employed in making decisions based upon chance'', ''that which is given as a rightful possession (often in the sense of an inheritance)'', ''a responsibility, function, or ministry which has been assigned to a person'', ''what has been assigned as someone’s responsibility to take care of'', ''a share or portion which has been assigned or granted'', ''(an idiom, literally: the lot falls upon someone) the process of choosing, with the probable implication of discerning God’s will in this manner'']'
κλιβανος	'[''Constructions'']'	'[''Miscellaneous Constructions'']'	'[''a dome-like structure made of clay, in which wood and dried grass were burned, and then after being heated, was used for baking bread'']'
κλινη	'[''Artifacts'']'	'[''Furniture'']'	'[''any piece of furniture employed for reclining or lying on'']'
κλινω	'[''Non-Linear Movement'', ''Linear Movement'', ''Time'', ''Aspect'', ''Stances and Events Related to Stances'', ''Physiological Processes and States'']'	'[''Leave, Depart, Flee, Escape, Send'', ''Duration of Time with Reference to Some Point of Time: Until, Delay, Still, From'', ''Cease, Stop'', ''Prostrate as an Act of Reverence or Supplication'', ''Tire, Rest'']'	'[''to cause something to incline'', ''to cause to flee or run away from'', ''to extend in time, with focus upon the end point'', ''to begin to come to an end, with particular reference to the period of a day (a figurative meaning dependent upon the position of the sun)'', ''(an idiom, literally: to incline the face to the ground) to prostrate oneself before someone as an act of reverence, fear, or supplication'', ''(an idiom, literally: to lay down the head) to experience the rest which comes from sleep'']'
κλῖτος	'[''Spacial Positions'']'	'[''Elevated Land Formations'', ''The Earth''s Surface'']'	a sloping place or incline in geography
κνήμη	'[''Body, Body Parts, and Body Products'']'	'[''Parts of the Body'']'	the front part of the lower leg below the knee
κοιλάς	'[''Names of Persons and Places'']'	'[''Depressions and Holes'']'	a low, hollow area of land, often between hills
κοιλια	'[''Body, Body Parts, and Body Products'', ''Body, Body Parts, and Body Products'', ''Psychological Faculties'', ''Attitudes and Emotions'', ''Physiological Processes and States'']'	'[''Parts of the Body'', ''Parts of the Body'', ''Desire Strongly'', ''Birth, Procreation'']'	'[''the entire digestive apparatus, including stomach and intestines'', ''the uterus'', ''(figurative extension of meaning of {L:κοιλία<SDBG:κοιλία:000000>}[a] ‘belly,’ {D:8.67}) the psychological faculty of desire, intent, and feeling{N:001}'', ''desire for gratification of the body'', ''(an idiom, literally: the womb carries) to experience the process of pregnancy'']'
κοιμάω	'[''Physiological Processes and States'']'	'[''Sleep, Waking'']'	to lie down or sleep; also metaphorically, to die
κοιτάζομαι	'[''Physiological Processes and States'']'	'[''Sit'', ''Sleep, Waking'']'	to place oneself in a reclining or resting position
κοιτη	'[''Artifacts'', ''Physiological Processes and States'', ''Moral and Ethical Qualities and Related Behavior'', ''Physiological Processes and States'']'	'[''Furniture'', ''Sexual Relations'', ''Sexual Misbehavior'', ''Birth, Procreation'']'	'[''a piece of furniture used for sleeping'', ''(a figurative extension of meaning of {L:κοίτη<SDBG:κοίτη:000000>}[a] ‘bed,’ {D:6.108}) to have sexual relations'', ''to engage in immoral sexual excess{N:001}'', ''(an idiom, literally: to have bed, though in combination with ἔχω, κοίτη early acquired the metonymic meaning of sexual relations) to be in a state of pregnancy.'']'
